<?xml version="1.0" encoding="UTF-8" standalone="no"?><xs:schema xmlns="http://notenoughupdates.org/moulconfig" elementFormDefault="qualified" targetNamespace="http://notenoughupdates.org/moulconfig" xmlns:xs="http://www.w3.org/2001/XMLSchema"><xs:complexType name="Widgetless"/><xs:complexType name="SingleWidget"><xs:group ref="AnyWidget"/></xs:complexType><xs:complexType name="MultiWidget"><xs:group maxOccurs="unbounded" minOccurs="0" ref="AnyWidget"/></xs:complexType><xs:group name="AnyWidget"><xs:choice><xs:element name="Text" type="Text"/><xs:element name="Scale" type="Scale"/><xs:element name="Center" type="Center"/><xs:element name="Slider" type="Slider"/><xs:element name="Row" type="Row"/><xs:element name="Gui" type="Gui"/><xs:element name="TextField" type="TextField"/><xs:element name="ScrollPanel" type="ScrollPanel"/><xs:element name="ItemStack" type="ItemStack"/><xs:element name="Array" type="Array"/><xs:element name="Hover" type="Hover"/><xs:element name="Spacer" type="Spacer"/><xs:element name="Column" type="Column"/><xs:element name="Button" type="Button"/><xs:element name="Switch" type="Switch"/></xs:choice></xs:group><xs:element name="Root" type="Root"/><xs:complexType name="Text"><xs:complexContent><xs:extension base="Widgetless"><xs:attribute name="split"/><xs:attribute name="shadow"/><xs:attribute name="textAlign"/><xs:attribute name="width"/><xs:attribute name="text" use="required"/></xs:extension></xs:complexContent></xs:complexType><xs:complexType name="Scale"><xs:complexContent><xs:extension base="SingleWidget"><xs:attribute name="scale" use="required"/></xs:extension></xs:complexContent></xs:complexType><xs:complexType name="Center"><xs:complexContent><xs:extension base="SingleWidget"/></xs:complexContent></xs:complexType><xs:complexType name="Root"><xs:complexContent><xs:extension base="SingleWidget"/></xs:complexContent></xs:complexType><xs:complexType name="Slider"><xs:complexContent><xs:extension base="Widgetless"><xs:attribute name="minValue" use="required"/><xs:attribute name="maxValue" use="required"/><xs:attribute name="minStep"/><xs:attribute name="width"/><xs:attribute name="value" use="required"/></xs:extension></xs:complexContent></xs:complexType><xs:complexType name="Row"><xs:complexContent><xs:extension base="MultiWidget"/></xs:complexContent></xs:complexType><xs:complexType name="Gui"><xs:complexContent><xs:extension base="SingleWidget"/></xs:complexContent></xs:complexType><xs:complexType name="TextField"><xs:complexContent><xs:extension base="Widgetless"><xs:attribute name="value" use="required"/><xs:attribute name="width"/><xs:attribute name="editable"/><xs:attribute name="suggestion"/></xs:extension></xs:complexContent></xs:complexType><xs:complexType name="ScrollPanel"><xs:complexContent><xs:extension base="SingleWidget"><xs:attribute name="width" use="required"/><xs:attribute name="height" use="required"/></xs:extension></xs:complexContent></xs:complexType><xs:complexType name="ItemStack"><xs:complexContent><xs:extension base="Widgetless"><xs:attribute name="value" use="required"/></xs:extension></xs:complexContent></xs:complexType><xs:complexType name="Array"><xs:complexContent><xs:extension base="SingleWidget"><xs:attribute name="data" use="required"/></xs:extension></xs:complexContent></xs:complexType><xs:complexType name="Hover"><xs:complexContent><xs:extension base="SingleWidget"><xs:attribute name="lines" use="required"/></xs:extension></xs:complexContent></xs:complexType><xs:complexType name="Spacer"><xs:complexContent><xs:extension base="Widgetless"><xs:attribute name="width"/><xs:attribute name="height"/></xs:extension></xs:complexContent></xs:complexType><xs:complexType name="Column"><xs:complexContent><xs:extension base="MultiWidget"/></xs:complexContent></xs:complexType><xs:complexType name="Button"><xs:complexContent><xs:extension base="SingleWidget"><xs:attribute name="margin"/><xs:attribute name="onClick" use="required"/></xs:extension></xs:complexContent></xs:complexType><xs:complexType name="Switch"><xs:complexContent><xs:extension base="Widgetless"><xs:attribute name="animationSpeed"/><xs:attribute name="value" use="required"/></xs:extension></xs:complexContent></xs:complexType></xs:schema>